{
  "contract_type": "model_manifest",
  "contract_version": "1.0.0",
  "status": "frozen_before_candidate_runs",
  "provider": "bailian",
  "endpoint_id_policy": "sha256_origin_prefix_12_no_path_query_or_credentials",
  "models": [
    {
      "logical_label": "qwen-3.8-max",
      "requested_model_id": "qwen-3.8-max",
      "allowed_response_model_ids": ["qwen-3.8-max"],
      "identity_rule": "exact_response_match",
      "live_preflight_required": true
    },
    {
      "logical_label": "glm-5.2",
      "requested_model_id": "glm-5.2",
      "allowed_response_model_ids": ["glm-5.2"],
      "identity_rule": "exact_response_match",
      "live_preflight_required": true
    },
    {
      "logical_label": "deepseek-v4-pro",
      "requested_model_id": "deepseek-v4-pro",
      "allowed_response_model_ids": ["deepseek-v4-pro"],
      "identity_rule": "exact_response_match",
      "live_preflight_required": true
    }
  ]
}
